,category,description,id,parkCode,title,url
0,Information,"Starting Friday November 1, 2019 and continuing until Saturday February 29, 2020, the Visitor Center and trail to the Cliff Dwellings will be operating on Winter Hours.",669A2C0C-0640-268B-8F5D194E27532191,gicl,Winter Hours,
0,Information,Visitors will encounter closures and long travel delays in Many Glacier in 2020 and 2021 due to large-scale road construction projects.,21F84D9B-DDE6-C4BC-BF1BF910F61F6FF3,glac,Many Glacier Road Construction,https://www.nps.gov/glac/planyourvisit/manyglacier.htm
0,Information,"The no-burn season at Ocean Beach starts November 1 and ends March 1, 2020. Beach fires are prohibited during the no-burn season. The no-burn season avoids burning during the Bay Area Air Quality Management District's (BAAQMD) Winter Spare the Air season.",5A963462-04A7-6134-93D3F9BF5A1AE7ED,goga,Ocean Beach No-Burn Season: November 1 through End of February,https://www.nps.gov/goga/learn/management/obfireprogram.htm
0,Danger,Golden Spike is anticipating heavy snowfall from the evening of February 2 to the morning of February 3rd. The park visitor center will likely have a delayed opening to allow the staff to clear snow.,52F43140-9143-9248-A0B9E97A8E3963BF,gosp,Winter Storm Warning February 2-3,
0,Information,"Visitors relying on GPS Units, in order to direct them to our site, need to be cautious once they turn off State Highway 83. Several different GPS systems have misdirected visitors headed to our site. Road signs are more reliable as you approach the site.",3E3819AE-1DD8-B71B-0BBFDD8F9F43D300,gosp,GPS Units,
0,Information,The locomotives undergo scheduled maintenance from mid-October to early-April. The locomotives are generally available for viewing in the Engine House during the winter maintenance season. Self-guided and ranger led tours are available most weekends.,0371A3B1-B3DF-BD66-4CC5629FD5CC3F4D,gosp,Locomotives On Display in Engine House for Winter,https://www.nps.gov/gosp/planyourvisit/hours.htm
0,Park Closure,Due to icy conditions Snake Creek Road is closed at the park boundary.,142E69B5-9C8D-4EC0-856BFC3EBD5F7BE5,grba,Snake Creek Road Closed at Park Boundary,
0,Information,There is snow and ice on the Wheeler Peak Scenic Drive. The road is open for the first three miles to Upper Lehman Creek Campground. If warmer weather allows the road to open before next spring we will post it here!,3D935823-9350-48FF-A682F255528087E1,grba,Wheeler Peak Scenic Drive,
0,Danger,"Most of the snow on the S. Rim has melted, however, foot traction devices & trekking poles are recommended for those hiking into Grand Canyon, especially on Bright Angel Trail. Dry and mild weather expected through the weekend, then snow likely on Monday.",65C1FB6D-D064-878B-9CCD04D0850D92E0,grca,A Few Icy Spots Remain on Roads and Trails - Updated Saturday 02/01/2020 7 am,https://www.nps.gov/grca/planyourvisit/weather-condition.htm
0,Information,"The North Rim Campground will be on a first-come, first-served basis from May 15, 2020 to August 31, 2020 due to a major waterline replacement project. Normal reservations will resume September 1, 2020 through the remainder of the 2020 season.",6137D589-F2D1-3DF9-2EE6FB92E18E6812,grca,North Rim Campground Alert - 2020 Season.,https://www.nps.gov/grca/planyourvisit/cg-nr.htm
0,Information,"On Saturdays, Sundays and Holidays, with good weather, expect high crowds and long vehicle delays entering the park.  Please come early or late.  Park open 7 am through Sunset.  Between 10:30 am and 4 pm, wait times to enter can be 45 minutes to one hour.",6713F2B4-1DD8-B71C-07A15005BD6CAFCC,grfa,EXPECT DELAYS,
0,Information,"Entrance fees for Great Falls Park will increase effective January 1, 2020. More information on this increase can be found at the link below.",2F10B154-CACD-230E-94E0055203B532F6,grfa,January 2020 Fee Increase,https://www.nps.gov/grfa/learn/news/great-falls-entrance-fees-to-increase-january-1.htm
0,Information,The Medano Pass Primitive Road is CLOSED beginning at the Castle Creek Picnic Area (2.6 miles from the southern entrance of the road near the Piñon Flats Campground within the park).  This does NOT affect paved road access to the dunes.,08E2149C-CDF5-1B2A-23C14BAE1A0DA0FD,grsa,Winter Closures on Medano Pass Primitive Road,https://www.nps.gov/grsa/planyourvisit/medano-pass-road.htm
0,Park Closure,"Cades Cove and Laurel Creek Road past the Great Smoky Mountains Institute at Tremont will be closed beginning 8:00 pm Sunday, January 5 through February 29, 2020 for repairs to the Bote Mountain Tunnel on Laurel Creek Road. The roads will reopen March 1.",00111C8B-0D20-5A18-F29053A4BE63BA35,grsm,"Cades Cove Loop Road Closed Jan. 5-Feb. 29, 2020",
0,Park Closure,Weather and road conditions can vary greatly in different elevations. Go to https://twitter.com/smokiesroadsnps for the latest road and facility closures.,4BC5C336-E9F3-EE6B-0BE8C1EB8C44B9FD,grsm,Road Closures Due to Weather Conditions,https://twitter.com/smokiesroadsnps
0,Information,"Pets are not permitted on most trails or in the backcountry in Guadalupe Mountains National park. They are only allowed in areas accessed by vehicles, including roadsides, parking areas, picnic areas and campgrounds.",0D7D05F2-1DD8-B71B-0B7408F5F119A0C4,gumo,"Restrictions on pet(s) trail access - park policy for safety, resource protection and preservation",https://www.facebook.com/guadalupe.mountains/photos/a.206361422744978.48037.120924901288631/1413538925360549/?type=3&theater
0,Information,The Civil War Museum on High Street is temporarily closed due to water damage. Other museums in Lower Town are unaffected and remain open.,0731C205-1DD8-B71B-0BEB961F8F021ED8,hafe,Temporary Closure of Civil War Museum,
0,Park Closure,The bathrooms located by the park Bookstore in Lower Town will be closed for renovations until March 2020. There are signs in place to direct visitors to the bathrooms located in the John Brown Museum.,2954A5F7-C4F6-D827-90799897C22E2535,hafe,Lower Town Bathroom Closure,
0,Information,"Elevator service to the historic floor is unavailable until further notice due to repairs.  Regularly scheduled tours of the historic floor are still available but may be accessed by the stairs only.
We apologize for the inconvenience.",4482FBE0-155D-451F-674BDFEFCA5D9C70,hagr,No elevator service,
0,Information,"To reduce the spread of non-native seeds and diseases, please clean your vehicles and any horse or stock trailers before traveling into the park.",1E6B28C9-1DD8-B71B-0BECBADCE60CFE77,hale,Protect Our Native Species,
0,Information,The park is closed on Mondays and Tuesdays for the Winter season.,3F7990D6-E71F-5898-0F07A71A5A7A265C,hofu,"Park Standard Hours, open Wednesday through Sunday 9 to 5, are in effect until Memorial Day.",
0,Park Closure,"Due to physical security concerns related to the access of the Cutthroat Unit, the unit is closed to public access.",05F21E50-BD1B-CCED-9744962F976BAFFD,hove,Temporary Closure - Cutthroat Unit,https://www.nps.gov/hove/learn/management/cutthroat-closure-080618.htm
0,Information,"Other than educational groups (limited to 24), advance reservations are not accepted. Tickets are first come first served. Please see page 22 of the park's Superintendent's Compendium in the link.",31BF5E89-D7B6-FDA2-3BB5E84702461770,hstr,NO ADVANCED RESERVATIONS ARE ACCEPTED FOR GROUPS OTHER THAN SCHOOLS,https://www.nps.gov/hstr/learn/management/lawsandpolicies.htm
0,Park Closure,The Truman Home is closed on Mondays from November 1 until Memorial Day. Tours are offered Tuesdays to Sundays.,60081B2E-CD60-A4AE-53840260A6DF1802,hstr,Winter Hours in Effect---Truman Home Closed on Mondays Until Memorial Day,
0,Information,The restroom facility at 5th and Chestnut Streets is closed.  Please use the public restrooms in the Independence Visitor Center at 6th and Market Streets.,2511106C-1DD8-B71B-0B3CEEF4E6A1B71D,inde,Restroom Closure on 5th Street,
0,Information,Know your beach's weather conditions and please use caution.,19C2B729-9279-0F4D-621ED877176A7C77,indu,Weather Watchers,https://forecast.weather.gov/MapClick.php?lat=41.6109&lon=-87.2225#.XWQzbui6OUn
0,Park Closure,"From November 1 - April 15 annually, Isle Royale and its surrounding islands are closed to all visitors. Lake Superior waters are open to boaters. All islands reopen April 16. The Houghton Visitor Center remains open Monday - Friday all year.",0A1D7A4B-B299-0723-F7D0EAE8824B77F9,isro,Island Closed from November 1 through April 15 Annually,
0,Park Closure,"All visitor centers will be closed on Monday, February 17, for the federal holiday. Barataria Preserve trails and Chalmette Battlefield/Chalmette National Cemetery grounds will be open but visitor centers at those sites will be closed.",3FA0A374-1DD8-B71C-0745789895B18B9D,jela,Presidents Day Closures,https://www.nps.gov/jela/planyourvisit/hours.htm
0,Park Closure,"The Prairie Acadian Cultural Center in Eunice is the ONLY park site open on Mardi Gras, Tuesday, February 25. All other Jean Lafitte visitor centers, grounds, trails, etc. are closed.",43EB488A-1DD8-B71B-0BDE23E865625B88,jela,"Mardi Gras: What's Open, What's Not",https://www.nps.gov/jela/planyourvisit/index.htm
0,Park Closure,The site is closed for renovations of the Visitor Center and will reopen in the Spring of 2021. No visitor access to the site will be available during 2020.,5924C23F-9162-57DB-33005794F7F4F113,jofi,Park closed until Spring of 2021,
0,Information,"Launching, landing, or operating an unmanned aircraft from or on lands and waters administered by the National Park Service within the boundaries of Kalaupapa National Historical Park is prohibited.  This includes model airplanes, quadcopters, and drones.",102A7E33-1DD8-B71B-0B02B65EA104FD14,kala,Unmanned Aircraft,
0,Information,"The park is implementing a new cashless entrance fee program, applicable at all parking lots within park boundaries, beginning Nov. 13.  Entrance fees are: $5 daily, $40 annual park specific. Click link for more information.",29251E7E-92A1-09D6-C43586F65317D5BF,kemo,Park Entrance Fee Program Starting November 13th 2019,https://www.nps.gov/kemo/planyourvisit/fees.htm
0,Park Closure,The Calumet Visitor Center will be closed from January through April 2020. We will open for special events such as Copper Dog 150 and educational events. Please stay tuned to the park’s website and social media pages for Visitor Center updates.,065DE98F-C769-0BE1-935DDEDAD25D43E8,kewe,Calumet Visitor Center Closed for the Winter,
0,Park Closure,"Kings Mountain NMP will be closed on Monday, January 20, 2020 in observance of Dr. Martin Luther King Jr. Holiday.  The park will re-open on Tuesday January 21 at 9:00 am.",0BEF7F02-C0AC-C2FC-CF5A1219209A4BB4,kimo,Dr. Martin Luther King Jr. Day Holiday Closure,
0,Information,"Due to an ongoing issue throughout rural Alaska, our Port Alsworth office landline phones are not in service at this time.  Please address inquiries to our email address, lacl_visitor_information@nps.gov, and we'll get back to you as soon as possible.",48AC9920-C56C-6076-5F5B72EC30E07639,lacl,"Port Alsworth Phones Out of Service Indefinitely, Please Contact via Email",
0,Information,"Federal Highways Administration has suspended the paving project for the winter. Spring dates are to be determined at a later date. Click ""More"" to take you the paving project page for more information.",4735F7A0-90AF-957F-2C69DC3AB84F4F57,laro,"Paving Project Update October 21, 2019",https://www.nps.gov/laro/planyourvisit/pavement-project.htm
0,Information,You now have the option to pay by credit card through your smart phone at all National Park Service operated campgrounds and boat launches at Lake Roosevelt National Recreation Area.,0852EED1-9B28-61E4-C6822F3C83CBF3B8,laro,Pay by Credit Card Option Now Available,https://www.nps.gov/laro/learn/news/pay-by-credit-card-option-now-available-for-lake-roosevelt-national-recreation-area-campsite-fees-and-boat-launch-permits.htm
0,Caution,"Due to undercutting action of Hawk Creek on the access road between the Hawk Creek campground and boat launch, the road will be reduced to one lane until further notice.",21757CFC-C3A1-3CF5-5DB34EAC64F97993,laro,Hawk Creek Lane Restriction at Lake Roosevelt National Recreation Area,https://www.nps.gov/laro/learn/news/hawk-creek-lane-restriction.htm
0,Park Closure,"During severe winter storms, road access to the southwest area and the visitor center may close temporarily and re-open as conditions allow. Please call (530)-595-4480 and press 1 for more detailed road information.",4F41C52E-E8EF-5367-7AA4BE08B18E0035,lavo,Kohm Yah-mah-nee Visitor Center Intermittent Closures,https://www.nps.gov/lavo/planyourvisit/conditions.htm
0,Information,"With winter wind storms coming and going, tree and trail damage will be fixed as weather and staffing allows. If there is a tree down or trail damage please report it to the visitor center with exact location of the damage.",42DA3E7A-1DD8-B71B-0B65EE40CD7BFDD0,lewi,Winter storms and trail damage,
0,Caution,"Recent water tests were positive for Legionella bacteria at three park sites. There have been no confirmed cases of illness, and park staff are working with the NPS Office of Public Health and Centers for Disease Control (CDC), to address this finding.",5A92F069-A56F-CC98-2D9D4BE3F5C2F5E9,lyjo,Park to Conduct Water System Assessment After Tests Find Legionella Bacteria in Water,https://www.nps.gov/lyjo/learn/news/tests-find-legionella-bacteria.htm
0,Information,Due to a high volume of group tour reservations - most of which are for weekday mornings - public tours of the site will often be limited to the afternoon.  Please call ahead if you're planning to visit so that we accommodate you as best we can,125947D0-B773-E695-956EB499F05258DB,mawa,"Limited Public Tours in February, Black History Month",
0,Caution,"Winter storms may cause opening delays or temporary closures so plows can safely clear the roads. If you plan to visit, please check our Facebook page at www.facebook.com/mesaverdenps for the most up-to-date information.",550C2D21-91B4-7920-9FE4E1A1E8523ADC,meve,Winter Storms May Cause Temporary Closures,
0,Information,Same-day tickets may be available if there are unsold reservations in the off-season period (October to April). Off-season same day tour tickets shall be sold by the park’s Eastern National bookstore between 8:00 a.m. and 12:00 p.m. for unreserved tours.,55B965C5-B5B3-C90B-AE2AC8B4D692C132,mimi,Off-season Same-day Delta-01 tour tickets,
0,Caution,"Vehicle Navigation Systems and GPS units may provide inaccurate information—sending drivers the wrong way on one-way roads, leading them to dead ends in remote areas, or sending them on roads which are impassable. Use the Interstate exits for wayfinding.",61588951-1DD8-B71B-0BC276F083C97883,mimi,Warning about GPS Systems!,https://www.nps.gov/mimi/planyourvisit/directions.htm
0,Information,"Beginning Saturday, November 1, 2019 and lasting until Friday, March 1, 2020, the visitor center will be open from 8:00 a.m. to 4:00 p.m., Tuesday through Saturday. The park will be closed on Sundays and Mondays. Delta-01 tours available Wed through Thu.",015BCAA9-9295-1E64-8764CBA851B2E5CC,mimi,Off-Season Operations,https://www.nps.gov/mimi/learn/news/nr20-01.htm
0,Information,All Delta-01 Launch Control Facility Tours require advanced reservations. Reservations can be made up to 90 days in advance on-line or by phone at 605-717-7629. No SAME-DAY tours available during the summer season.,43855F62-1DD8-B71B-0BCC7A39A7CEA243,mimi,Delta-01 Tour Fee and Reservations,https://www.nps.gov/mimi/planyourvisit/launch-control-facility-delta-01-tours-and-tickets.htm
0,Information,"Please note that operating hours have changed. The park is open Monday - Sunday, 9 am - 5 pm. The Visitor Center is open Tuesday - Saturday, 9 am - 5 pm. The park is also closed on all Federal holidays! Please plan your trip accordingly.",27475507-C921-0641-23BE7DA53B003145,mocr,Updated Operating Hours,
0,Caution,"Please stay on the trail to limit exposure to ticks, chiggers (red bugs), and poison ivy.",083F2CA6-B2E4-EDDE-28EA9D41357704F4,mocr,Please Stay on the Trail,
0,Information,"Sledding is allowed ONLY in the designated area, and it may close if conditions deteriorate. Check MountRainierNPS on Twitter for updates on the status of the snowplay/sledding area (Twitter account not required to view).",0E52C3B9-F018-213E-A04845242AA567BB,mora,Paradise snowplay/sledding area is OPEN.,https://twitter.com/MountRainierNPS
0,Information,Roads and facilities in the park may close at any time due to severe weather. Always check MountRainierNPS on Twitter for current conditions and road status updates before coming to the park (account not required to view).,4F96722C-1DD8-B71B-0B15624C1FE727DF,mora,Check Twitter for updates on current conditions; roads/facilities may close due to adverse weather,https://twitter.com/MountRainierNPS
0,Information,Jockey Hollow buildings are closed and the Washington Headquarters facilities are open Saturdays and Sundays ONLY through February 15.  Grounds and roads are open daily 8 AM-5 PM. Please check the park web site or Facebook page for more information.,0698D98A-E684-7D54-D6BF808FAC9C5899,morr,Park Winter Hours now in effect.,
0,Information,"Due to the opportunity to address deferred maintenance projects, the Lincoln Borglum Visitor Center, amphitheater, Avenue of Flags and a short section of the Presidential Trail are not available during early 2020.",031F10E8-B0B8-FDAC-F5CEEBBF1BA58886,moru,Deferred Maintenance Projects During 2020.,https://www.nps.gov/moru/planyourvisit/deferred-maintenance-project-information.htm
0,Information,Both trails remain closed due to snow and ice.,2BC4F154-B213-23D0-7A50CAC4EC85AEE1,moru,Presidential Trail and Nature Trail Closed,
0,Information,Reservations are now required for all personal vehicles and shuttle riders at Muir Woods. You can make your reservation by visiting www.gomuirwoods.com.,3160D117-1DD8-B71B-0BFACB04EBA6DBEB,muwo,Parking Reservations Required,
0,Information,"Effective March 4, 2018, the William Johnson House site will be open from 12:00 pm until 5:00 pm on Sundays.  The site will be open Monday through Saturdays from 9:00 am until 5:00 pm with an hour closure from 12:00 until 1:00.",043EFA7C-1DD8-B71B-0BCAE0DCF004BBBF,natc,William Johnson House Hours of Operation,
0,Caution,"Extended drought conditions have caused severe cracking and movement of the Natchez Trace Parkway road surface in Mississippi. All motorists, motorcyclists and bicyclists should use caution and be alert to uneven road surfaces.",1DDCE874-1DD8-B71B-0B99B8ABB54E49EE,natr,Uneven Road Surfaces in Mississippi,https://www.nps.gov/natr/learn/news/natchez-trace-parkway-pavement-problems-for-mississippi-travelers.htm
0,Information,Use the link below to visit the National Weather Service website for current weather conditions in the park.,030BA669-AD4D-F7A9-CCD604862DB7F1C5,nava,Current Weather Conditions,https://forecast.weather.gov/MapClick.php?lat=36.6888&lon=-110.5248#.XSihQOi6OUk
0,Park Closure,The Keet Seel Hike is closed for the 2019 season and will reopen May 2020. We will begin taking reservations in February 2020 by phone call or in person at the visitor center.,2B4226B2-C95C-C7F1-DAC27FBAF997195B,nava,Keet Seel is CLOSED until May 2020,
0,Information,There are several projects currently going on in the park to help make improvements to visitor experiences. Check the road and trail closures page for important information that may affect your visit.,2AA7859F-1DD8-B71B-0BE8A1E68866C0B8,neri,Road and Trail Closures,https://www.nps.gov/neri/planyourvisit/road-and-trail-closures.htm
0,Information,"Keeneys Creek Road to Nuttallburg is currently closed due to a washout. At this time there is no access to Nuttallburg. The road will be closed for the foreseeable future, likely through the remainder of 2019.",26F2B404-1DD8-B71B-0B2AF18EF6DF64F5,neri,Keeneys Creek Road to Nuttallburg closed,
0,Information,Keeney's Creek Rail Trail is currently closed for repairs resulting from flooding.,1F1C63A9-1DD8-B71B-0B6A450A2DF6E816,neri,Keeney's Creek Rail Trail Closure,
0,Caution,"By Nebraska State law, all children 12 years old and younger must WEAR a USCG approved life jacket to float the Niobrara NSR. Anyone over 12 years old must HAVE a life jacket. If you are renting equipment, your outfitter will provide them.",13E85374-1DD8-B71B-0BF4B6A13BC2DE2D,niob,Life Jackets Required!,
0,Caution,"Gorge, Diablo and Ross lakes are reservoirs with changing water levels. The lakes are generally at full pool from July-September. Boat launches and docks may be difficult to access at low water levels.",25563C58-1DD8-B71B-0B39DBEED3755C64,noca,Fluctuating Lake Levels,https://www.nps.gov/noca/planyourvisit/lake-and-river-conditions.htm
0,Park Closure,Alava trail is closed due to construction.,3048160B-0982-650D-80845A7ECDF47428,npsa,Alva Trail Temporary Closure,
0,Park Closure,"Please be aware that the Lower Sauma trail is CLOSED due to construction, until further notice.",39ADCB34-E5C7-E3E3-91EA38B006011F78,npsa,Trail Closure,
0,Information,"See link for detailed information:
https://www.nps.gov/articles/one-health-disease-mosquito-borne.htm",06ABCFC5-A0D1-77F2-1EB24F7A6104C0DC,npsa,Mosquito Bite Prevention,
0,Park Closure,"Due to riverbank erosion along Upper Hoh Road, Jefferson County has closed the road for safety until repairs are completed. The Hoh Rain Forest area of the park is current inaccessible. The Hoh Campground and Visitor Center are closed.",4D045AC5-C5A3-9DF2-A284731C6409C07A,olym,Upper Hoh Road Closed at Milepost 8 Outside the Park Boundary,https://www.nps.gov/olym/learn/news/temporary-closure-of-hoh-rain-forest-area-due-to-road-washout-outside-park-boundary.htm
0,Caution,"At this time of year, cold weather may lead to icy conditions in the parking lots, along walkways, and on the bridges. Please use caution while walking around the park.",2655F7EF-A5F1-DBD8-9BC4F670E9F1A578,pagr,Icy Conditions,
0,Danger,"During the winter expect impassible roads above 4,500 feet, even if you have 'mud-terrain' rated tires. Travel not advised at higher elevations until conditions dry in the spring. Winter storms can also make roads below 4,500 feet temporarily impassible.",3AB4483F-C8EE-B0E8-D50A9807059F9A09,para,"Winter Travel Warning: Expect Deep Mud, Washouts, and Impassible Conditions Above 4,500 Feet",https://www.nps.gov/para/contacts.htm
0,Information,"In order to use an ATV/UTV on NPS roads and Mohave County roads in the monument, it must be registered and meet Arizona street legal (on-highway use) requirements including appropriate insurance and mandatory equipment.",46F855A6-1DD8-B71B-0B7C550BD0C78F7A,para,Bringing an ATV/UTV from Out of State?,https://www.azgfd.com/ohv/
0,Information,Grand Canyon National Park is only part of the 277 mile-long Grand Canyon. Click More for the national park site. GC-Parashant starts on the north rim of the Grand Canyon west of the national park boundary at Toroweap and stretches to the Nevada line.,5849D0AA-1DD8-B71B-0B6C3A07D4480FC5,para,Grand Canyon-Parashant National Monument is not part of Grand Canyon National Park,https://www.nps.gov/grca/index.htm
0,Information,Work crews are installing and welding fences at Pakoon Spring to prevent wild burros from trampling spring vegetation and restoration areas. The site is open to visitors during the project.,60E95EB6-1DD8-B71B-0B4251294965AE85,para,Fence Welding at Pakoon Spring,
0,Information,"While Pecos is close to Santa Fe and Las Vegas, services like Uber and Lyft may have limited availability to and from the park. If you are able to take an Uber or Lyft, please make sure you have plans to be picked up before being dropped off at Pecos.",4838DDB8-99D7-17D9-0032915320EF0058,peco,"Uber, Lyft, and other ""Taxi"" Services",
0,Information,"The Five Forks Battlefield and General Grant's Headquarters Unit Visitor Contact Stations will be closed from December 1 - February 29. Although the contact stations are closed, visitors can still tour the grounds which include numerous wayside exhibits.",363B2B1D-9571-3B68-90297555C2BA3309,pete,Seasonal Closures: December 1 - February 29,
0,,This is an urban park. Do not invite a thief. Do not leave valuables visible inside your car. Be sure to lock your vehicle and set car alarm. Increased parking lot patrols by park rangers have been effective in preventing recent break-ins.,1FD48538-1DD8-B71B-0BB1F019584202E9,petr,"Visitors please take precautions to secure your vehicle and valuables, as you would in any city.",
0,Information,"Bicycles are ONLY allowed at the following locations:

1 - On the Boca Negra Canyon paved multiuse path; bicycles must remain on the paved bike path. 
2 - On the crusher fine trail that winds in and out of the park around the mesa top above Boca Negra.",0525B6FD-A68E-F785-D6D83C68CA602388,petr,Bicycle Use In The Monument,
0,Information,Visitation is highest on weekends. Expect parking lots to fill by 10:00 am. Delays to enter the park may occur.,6863F60D-BCB3-6930-8E3C9805947D09AA,pinn,High Volume of Weekend Traffic,
0,Information,Winter hours for the Munising Falls Visitor Center are Wednesday - Saturday from 9:00 am to 4:30 pm. Closed on federal holidays.,1676736A-F9E2-8B1E-09EE3C96D8ACAB98,piro,Winter Visitor Center Hours,https://www.nps.gov/piro/planyourvisit/visitorcenters.htm
0,Information,"Snow has closed many park roads, including those to drive-in campgrounds. Please be aware that only ONE park road - Sand Point Road - is plowed in winter. See https://www.nps.gov/piro/planyourvisit/winter-road-closures.htm",2A9C742B-F704-6C92-359B138D506AF551,piro,Road Conditions,https://www.nps.govhttps://www.nps.gov/piro/planyourvisit/winter-road-closures.htm
