,category,description,id,parkCode,title,url
0,Information,"On weekends & federal holidays, Sir Francis Drake Boulevard may be closed beyond the South Beach Road junction from 9 am until ~5:45 pm during favorable weather conditions. Bus service to the Lighthouse & Chimney Rock is provided from Drakes Beach.",0D1C0102-155D-4519-3E562F454506717D,pore,Point Reyes Headlands Winter Shuttle Bus System,https://www.nps.gov/pore/planyourvisit/shuttle.htm
0,Information,Entrance fees will increase effective 1-1- 2020. Entrance Fees are used to support visitor services and facilities within the park and National Park Service. For more information visit the Fees and Passes page.,2D2E6F8B-E650-5433-4D2F94C6C524D1FB,prwi,Entrance Fees Increase effective 1-1-2020,https://www.nps.gov/prwi/planyourvisit/fees.htm
0,Information,"Richmond National Battlefield Park does not sell the Senior or Annual National Park Service passes.  For a list of sites that do sell passes, please visit https://store.usgs.gov/pass/annual.html",4B5157A8-1DD8-B71B-0BCBBFA1ACF3147F,rich,Richmond National Battlefield Park No Longer Sells Senior or Annual National Park Passes,https://store.usgs.gov/pass/annual.html
0,Danger,"For visitor safety, the southern end of the Glover-Archbold Trail is under an emergency closure until further notice due to aerial hazards. Please follow the posted detour along Foxhall Rd. / 44th St. NW / P St. NW.",6253FA01-1DD8-B71B-0B4C90C2F7345482,rocr,Glover-Archbold Trail Detour,https://www.nps.gov/rocr/planyourvisit/trail-closure-detour.htm
0,Park Closure,"Between Nov. 20, 2019, and Mar. 31, 2020, temporary night-time road closures will be in effect for visitor safety during annual deer reduction activities.",63CCAA40-1DD8-B71B-0B3347F88B46BAB3,rocr,Temporary Night-time Road Closures,https://www.nps.gov/rocr/learn/management/white-tailed-deer-management.htm
0,Information,"Park fountains have been turned off for the season. Locations: Meridian Hill Park, Georgetown Waterfront Park, Chevy Chase Circle, and the Kahlil Gibran Memorial Garden. Fountains expected to reopen by Memorial Day 2020.",3C31EB8E-DE92-653C-2BAA5BD4C5032B08,rocr,Park Fountains Closed for Season,
0,Park Closure,"The Planetarium is closed for repairs--likely to reopen in Spring 2020 at a date TBD. For updates, check this website, follow us on Facebook @RockCreekNPS, or ask to be added to the park's email list (202-895-6000 or rocr_superintendent@nps.gov).",19452B89-E239-21F9-FDEA0F6E71ED8400,rocr,Planetarium Programs Temporarily Canceled,
0,Caution,"Avalanches can be easily triggered by backcountry travelers. The park does not do any avalanche control. Never assume trails are free of avalanche hazard. Check current avalanche conditions before your visit by clicking ""more.""",0F4A72B7-1DD8-B71B-0B44BED16B9B1B65,romo,Avalanches: Be Alert,http://avalanche.state.co.us
0,Information,"Due to electrical work at Mission Espada, the restrooms at Mission Espada will be closed from 1/28 to 2/3/2020. Disruptions may continue into the next week. Nearest restrooms are 0.4 mi east of Mission Espada on Camino Coahuilteca, at River Rest area.",0B2B1691-091B-E537-412F2DE547F5CFB9,saan,Electrical Work at Mission Espada,
0,Park Closure,Water systems have been shut down along the St. Croix and Namekagon rivers. Please plan on bringing water with you if you are heading out on the river.,5A02FFDE-155D-4519-3E688C7AF28675CC,sacn,Wells Closed for Season,
0,Information,"During weekends, holidays, and school breaks there is a high demand for tickets to tour the Roosevelt Home. Tickets sometimes sell out as early as noon. Visitors should arrive early to pick up these first come, first served tickets.",0FC0D06E-EA9C-0608-41561EB7D6051E24,sahi,Limited Number of Tickets to Tour the Roosevelt Home,https://www.nps.gov/sahi/planyourvisit/fees.htm
0,Information,"Between November 1 and June 1, there will no visitor services (restrooms, museum, visitor center, and store). However, the grounds remain open year round. Enjoy them safely!",1A4076D5-047A-6821-0FF11D35EFF762E4,sair,No Visitor Services,
0,Information,Historic preservation projects are ongoing at the site which limits access to some areas. Restricted areas are subject to change in consideration of the safety of our staff and visitors.,4706D935-1DD8-B71B-0B2C5C278841802F,sair,Ongoing Historic Preservation at the Site,
0,Park Closure,"Sand Creek Massacre National Historic Site will be closed on Tuesday February 4th and Wednesday, February 5th. The closure will allow annual training and meeting time to discuss park operations.",0F02668B-0A86-95F1-FBBBD41134C5953E,sand,Park Closure,https://www.nps.gov/sand/learn/news/sand-creek-massacre-national-historic-site-closed-february-4th-5th.htm
0,Information,The Tour Road is closed from December 1 to March 31.  The Visitor Center is closed on Tuesdays from December 1 - March 31. Grounds are open sunrise to sunset.,66235BED-DE5D-130A-07B837ABBC066F72,sara,Winter Hours,
0,Information,"The Visitor Center will be closed Sunday, December 1 and Sunday, December 8 due to staffing. The grounds are open sunrise to sunset.",663367F6-B68C-FFBD-18C2DC6E6F3C5DA9,sara,Visitor Center Closure,
0,Park Closure,Vehicular use of the Summit Road is weather permitting. Access can be restricted for visitor safety at any time. Please call the park for updated conditions: (308) 436-9700 x700,5B8CD6F7-D0E1-9973-409ABB21A34DB0F8,scbl,Summit Road Access- Weather Permitting,
0,Caution,"Be vigilant for clusters of yellow jackets near the ground; these areas could be disturbed yellow jacket nests. If you are allergic to bee/wasp stings, make sure you carry your Epi pen (epinephrine). You may also want to carry basic sting treatment.",1C68C9D3-9A26-3AAD-5B399B5518440F65,shen,Hornets and Yellow Jackets Warning,https://www.nps.gov/shen/planyourvisit/alerts.htm
0,Caution,"Vehicles will not be permitted on the park tour road, visitor center parking lot, national cemetery or Stop #5 until 8 AM on Saturday March 7, 2020. Vehicles may not be able to access the Old Nashville Highway from the park until after 8:30 AM.",2144EA2D-1DD8-B71C-079718EEB7ACA7D3,stri,"Special Kids Races Closures - Saturday March 7, 2020",http://specialkidsrace.org/
0,Caution,"A reminder that bison are wild animals and will defend themselves if feeling threatened. A raised tail is a warning sign and the animal may charge or give chase. Please give a wide distance, at least 100 yards. You can also hike around Windmill Pasture.",44EBF893-155D-9421-1F2C427BA96B5CB2,tapr,Bison Are Wild Animals,https://www.nps.gov/tapr/planyourvisit/safety.htm
0,Information,"Starting October 1 2019, preference is given to reserved groups of 10+ people during the 11am and 1pm tour times. If visiting during these times, call the visitor center at 
(212) 260-1616 to confirm if these times are available to the public.",4DBFF6FE-9575-D287-F6ED220077D436C3,thrb,Tours,
0,Caution,"Due to Allen St. reconstruction, Franklin St. is blocked at Allen.  Cars should use the Delaware lot entrance.  Buses should disembark on Delaware Ave. in front of the Site and should NOT try to enter the Delaware ramp.  Franklin St. is temporarily 2-way.",16EB4BEF-D997-8A24-0106A4C566C4EA53,thri,Road closures nearby,
0,Park Closure,North Unit Scenic Drive: OPEN 6 miles from hwy 85 to Caprock Coulee Trailhead. Remaining miles are CLOSED until further notice due to snow and ice.,0702FCEB-155D-4519-3E728B336A9885AF,thro,Weather-related Road Closures,https://www.nps.gov/thro/planyourvisit/roadclosures.htm
0,Information,"GPS navigation systems often misdirect visitors driving to Ulysses S. Grant National Historic Site. GPS systems often route visitors to our back gate, or to the entrance for Grant's Farm (not affiliated with the NPS). Please visit our directions page.",055E4813-0B1A-740E-65583984DF630CED,ulsg,GPS Navigation Systems,https://www.nps.gov/ulsg/planyourvisit/directions.htm
0,Information,"Our Temporary Visitor Center offers park information, a full-service bookstore, refreshments, a theater, restrooms and regional visitor information. The park's permanent Visitor Center is currently closed for construction through Spring 2020.",0B3B0572-0A9A-72DF-E54F0659D4EFA99F,vafo,Temporary Visitor Center is Open for Business,https://www.nps.gov/vafo/planyourvisit/visitorcenters.htm
0,Information,"Effective immediately, a short portion of the Chapel Trail, from the Washington Memorial Chapel to the Sullivan's Bridge Trail, will be closed through Summer 2020 due to the U.S. 422 Schuylkill River Bridge construction project.",0B2070A4-B9FC-A342-5C6BFE736390261A,vafo,Chapel Trail Closed East of Washington Memorial Chapel,
0,Caution,"Hantavirus pulmonary disease is a rare but serious disease that humans can contract through contact with infected rodents or their urine, saliva, blood, or droppings. Reduce exposure by staying out of structures not open to the public.",39EEC6C4-1DD8-B71B-0B115E2D8F8CEA3B,vall,HANTAVIRUS PULMONARY DISEASE,http://www.cdc.gov/hantavirus/
0,Information,"While within preserve boundaries, the removal of any artifact, antler, obsidian,
and other mineral or plant material is strictly prohibited.",43398198-1DD8-B71B-0BC38266D0FEE4C1,vall,RESOURCE COLLECTING - All natural and cultural resources are protected,
0,Caution,"The road from the main entrance to the Valle Grande Entrance Station is snowpacked and icy.  Vehicles with 4WD and/or chains are strongly advised.  For information about Hwy. 4 conditions, please visit the New Mexico Department of Transportation's website",519FA0B4-1DD8-B71B-0B81C6D543A2DB14,vall,WINTER ROAD ADVISORY - Snowpacked & Icy Roads,http://nmroads.com/
0,Park Closure,During the winter the park and trail may close due to severe weather. The park trail receives no winter maintenance so visitors should be prepared for potential snow and ice on the trail following winter storms.,329FA57B-B7BC-AFDC-121FFCD3325629B8,waba,Winter Weather Warning,
0,Information,"Please note park buildings are closed for the season (Open May-October). Park grounds are open daily year-round and maps, brochures, and passport stamp are available in the parking lot kiosk. Restrooms may or may not be locked during the off-season.",3EB5C9FD-155D-451F-67EF41684C71E22F,wefa,"Weir House, Weir Studio, Young Studio, and Visitor Center Closed",
0,Information,Our parking lot cannot accommodate RV's or trailers. Please call the visitor center for options as we have a nearby lot for trailers to detach and are happy to help visitors in RV's plan their way to the park. RV's should NOT pull into the parking lot.,016CC9DB-1DD8-B71B-0B116D5332CAE19A,wefa,No Recreational Vehicle (RV) Parking,
0,Information,The NPS published final regulations in the Federal Register which allow federal subsistence users in Alaska to collect and use non-edible animal parts and plants for the making and selling of handicrafts.,358BBEC3-1DD8-B71B-0BAA40DEA3D4A695,wrst,NPS Finalizes Subsistence & Wildlife Collection Regulations,https://www.nps.gov/orgs/1840/subsistence-wildlife-regs-2017.htm
0,Information,"Baiting for black and brown bears is prohibited in Wrangell-St. Elias National Preserve. Regulations also prohibit taking wolves and coyotes (including pups) from May 1 through August 9 and prohibit using dogs to hunt big game, including black bears.",290664CF-1DD8-B71B-0BC5EEBF35E8EB95,wrst,New Regulations Prohibit Brown and Black Bear Baiting,
0,Information,The main phone number for the Wupatki Visitor Center occasionally experiences outages during thunderstorms. If you cannot reach us on the main line please call 928-856-1705 for park information.,37CDD021-024A-72BC-B3EA784918771A7D,wupa,Visitor Center Phone Outage,
0,Park Closure,"Tioga Road (continuation of Highway 120 through the park) and Glacier Point Road are closed for the season due to snow. They usually reopen in late May or June. Tire chains may be required on other roads; call 209/372-0200 (then 1, 1) for road conditions.",35170CDD-B913-92C7-958CE8F9048C22D3,yose,Tioga Road and Glacier Point Road (beyond Badger Pass) are closed for the winter,https://www.nps.gov/yose/planyourvisit/wroads.htm
0,Information,"In mid-June 2017, volunteers and National Park staff spent ten days rehabilitating the airstrip near the Gelvin’s cabin. Located 75 river miles up the Charley River, the airstrip had been unusable since 2013, when a flood washed out much of the airstrip.",3FC3A1FB-1DD8-B71B-0BA7C3EA26D73697,yuch,Gelvin's Airstrip Repaired,https://www.nps.gov/yuch/planyourvisit/floatingthecharleyriver.htm
0,Park Closure,"Due to the approaching winter storm, the Kolob Canyons Road will be closed at 6:00 pm February 2, 2020. It will remain closed until it can be cleared after the storm.",67FA7AFD-AC2D-F8B7-26A1115D021796AC,zion,Road Closures,https://twitter.com/ZionNPS
0,Information,Please return requests for ranger-led programming by e-mail while our fax line at 212.227.2026 is undergoing repairs. Thank you.,BBA60B35-1DD8-B71B-0B713526C005A058,afbg,Fax Machine Down,
0,Information,Use (308) 665-4113 to contact the park or click the Contact Us link on the left side of this page to email a ranger.,8182F40E-E4E4-415E-2D0F019BF9A4B404,agfo,Some Park Phone Lines Intermittently Out of Service,
0,Caution,"Samples collected from Lake Amistad in December 2018 tested positive for zebra mussel DNA.  These findings do not indicate that live adult zebra mussels are in the lake, but place us in the inconclusive status. Click the link to learn more:",87005A1E-E6C3-EE00-0151679829BFF942,amis,Zebra Mussel Alert,https://www.nps.gov/amis/learn/aquatic-invasive-species.htm
0,Information,"Comfort stations in Anacostia Park have been winterized for the season. This includes the comfort stations at Park Node (Nicholson St. SE), and the Skating Pavilion. The comfort stations outside of the AREC remain open all winter.",C7EC43AA-D4A9-13BF-B98DC4CAB27133F7,anac,Restrooms Closed for the Season,
0,Information,"Andrew Johnson NHS will transition to new hours of operation Thursday, January 2, 2020. The new hours will be 9 am to 4 pm, Monday through Sunday. Public tours of the Andrew Johnson Homestead will be offered at 10:30 AM, 11:30 AM, 1:30 PM, and 2:30 PM.",C80CAFF3-A1B9-5452-91F33CF2D62B97CB,anjo,New Hours of Operation,
0,Information,"Beginning January 27 and possibly lasting until February 12, the park will experience construction during the installation of fiber optic connectivity to park headquarters. Visitors may experience minor closures and noise disturbance during this time.",A736C011-EED7-91B8-71147076F8936809,apco,Construction in the park beginning Jan. 27,
0,Park Closure,Overmountain Shelter in North Carolina has been closed by the U.S. Forest Service until further notice. The fields around the shelter are still open for tent camping but the shelter is closed.,A835BBC3-F254-8AFA-C8DA66BE57FDFB62,appa,OVERMOUNTAIN SHELTER IN NORTH CAROLINA CLOSED UNTIL FURTHER NOTICE,http://www.appalachiantrail.org/home/explore-the-trail/trail-updates
0,Park Closure,"On December 21, a CSX train derailed across the Potomac River in Harpers Ferry, WV. There were no injuries or hazardous materials involved, but the attached footbridge that the A.T. follows is indefinitely closed. A.T. hikers will need a shuttle. See more",D1B87E66-B85A-613F-5D3BC7983ACF213D,appa,TRAIN DERAILMENT CLOSES POTOMAC FOOTBRIDGE IN HARPERS FERRY WV,https://www.appalachiantrail.org/transportation
0,Information,"Bandelier is in a remote location, with cell service in the canyon limited to Verizon 4G only. Services like Uber and Lyft will bring you here, but there may be no way to contact a ride out. Please plan your pickup before being dropped off at Bandelier.",9206CFFB-1DD8-B71B-0B8F5B25B74E5C5C,band,"Uber, Lyft, and other ""Taxi"" services",
0,Information,"At this time, food (except small snacks and bottled water) is not available for purchase within the monument. Please plan accordingly.",972D3561-1DD8-B71B-0BB217E9CED96D66,band,No Food Service Available,
0,Park Closure,"Due to public and wildlife safety concerns, the Burns Lake Campground borrow pit is closed to all fishing and boating for the month of January, 2020. The campground remains open to public use.",A35E86D0-B149-C557-12ED46AD7A3F701C,bicy,Burns Lake Temporarily Closed to Fishing & Boating For January 2020,
0,Information,"Currently, the use of drones is prohibited at Big South Fork and all National Parks. Detailed information about the policy is available...",B5021FEE-1DD8-B71B-0BDBFF48A6A46974,biso,The Use of Drones is Prohibited at Big South Fork National River & Recreation Area,https://www.nps.gov/policy/PolMemos/PM_14-05.htm
0,Information,"Firewood ban is in effect for the park. Only firewood from the surrounding counties of  Scott, Morgan, Pickett, and Fentress, in Tennessee, and McCreary in Kentucky, can be brought into the park. Firewood is for sale or you may use dead and down wood.",85FDF60C-1DD8-B71C-0E445151F456192A,biso,Firewood ban is in effect for the park.,https://www.nps.gov/biso/planyourvisit/firewood-quarantine.htm
0,Information,"Black bears call Big South Fork NRRA home. Help keep them healthy and safe by storing all food, cooking items, feed, cosmetics and coolers properly stored when at campgrounds or in the backcountry.",865F2013-1DD8-B71C-0E38B42BE13C7442,biso,Black Bears at Big South Fork,https://www.nps.govhttps://www.nps.gov/biso/learn/nature/blackbear.htm
0,Park Closure,"East Portal and North Rim Roads are closed for the winter. South Rim Drive is open to the Visitor Center, but the remainder of the road is closed due to snow.",85F86473-9004-FC77-001048E8C95390F2,blca,Road Closures,
0,Park Closure,Temporary weather-related closures are in effect along the parkway. Please check the real-time map for updates to the road status.,88E6A7CE-1DD8-B71B-0B3982ECAB31CC7A,blri,Closures Due to Weather,https://www.nps.gov/maps/full.html?mapId=e212fcb5-4ff9-4787-bbe4-3d40cc0d0daa#9/36.8390/-80.6506
0,Information,There is currently no access to the Bluestone Turnpike Trail through Bluestone State Park. The road from the Bluestone State Park Visitor Center to the trailhead is currently closed due to slides. It is expected to be open by Memorial Day 2019.,BD7C61FE-0E01-8150-500DD08C1D285E03,blue,Access to Bluestone through Bluestone State Park closed,
0,Information,"During the winter, ranger-led programs may be cancelled if the outdoor air temperature or combined wind chill temperature is below 10°F (-12.2°C).",B16734C9-D450-FF03-5BF41A6C58CEBF99,brca,Winter Ranger-led Program Cancellation Policy,
0,Information,"Most campground amenities will close on November 15 for the season. Campgrounds will remain open through the winter, but flush restrooms, showers, drinking water, and electricity will be unavailable. It is free to camp, primitively, until March 13, 2020.",95F6AFAF-9C6C-B9D9-B8076342AFCA813F,buff,Limited Amenities Available in Campgrounds,
0,Information,Arkansas Agriculture Department’s State Plant Board (ASPB) has approved a statewide quarantine which covers firewood of all hardwood species.,7F45F1E1-1DD8-B71B-0B36A4471B73E561,buff,Statewide quarantine for firewood.,https://www.nps.gov/buff/planyourvisit/firewood.htm
0,Park Closure,Compton-Erbie Rd. (County Road 2700) is closed for repairs. The Schermerhorn/Hideout Hollow Trailhead and Erbie Horse Camp will remain open on each end of the road closure. Projected completion: Spring 2020.,7CC49200-1DD8-B71B-0B839BB8A136E13B,buff,Compton-Erbie Road Closure,
0,Park Closure,"Visitors are advised that the Cabrillo Sea Cave is located within a closed area of the park. Due to extremely dangerous conditions and in compliance with the Marine Mammal Protection Act, no entry is allowed at any time. Closure enforced by Federal law.",90709F33-1DD8-B71B-0BB7E73F8C6A284B,cabr,Cabrillo Sea Cave Closed,
0,Information,"Casa Grande Ruins National Monument no longer charges a fee to enter the monument. The Annual and Senior passes are no longer available for purchase, however we are still able to issue the free passes.",8407729F-BD92-F6BA-C7B17872A9CBE9D6,cagr,Casa Grande Ruins National Monument is fee free,
0,Caution,"Headed to the beach? Before you go, check the daily rip current forecast and learn more by clicking the link.

Text ""Join OBXBeachConditions"" to 30890 to sign up for text alerts on beach conditions.",B62318C3-1DD8-B71B-0B131B45B0E8A6D1,caha,Swim Safe! Rip Current Information,http://www.weather.gov/beach/mhx
0,Information,The picking of saw palmetto berries within Canaveral National Seashore is prohibited.,C85D25D2-1DD8-B71C-07FDE9AAFC49EC09,cana,PICKING SAW PALMETTO BERRIES PROHIBITED,
0,Information,"Effective May 22, 2017, recreational crab fishing along Mosquito Lagoon in the Playalinda district of Canaveral National Seashore will be prohibited. Alligators are now accustomed to visitors crabbing or stopping on the roadway & associate food w/ people.",824A9788-1DD8-B71B-0B8238FFD12ED344,cana,Recreational Crab Fishing At Playalinda Beach,
0,Information,"Turtle Mound is closed for boardwalk repair in the Apollo Beach District until further notice.
Playalinda Beach parking area #8 is closed for boardwalk repair.",B1663F1E-F5D8-1737-8C2CBE3F5C5A1945,cana,Area's Closed Temporarily,
0,Caution,Winter storms can quickly change unpaved roads to four-wheel-drive condition or make them impassable. Roads may close temporarily due to snow. Trails may be snow-covered or icy.,A3C60CC3-1DD8-B71B-0BF9569BF77ECB06,cany,Winter Weather,https://www.nps.gov/cany/planyourvisit/road-conditions.htm
0,Caution,There is dense fog at Island in the Sky creating very low visibility. Use caution when driving in the park.,A1985FFD-F49E-5374-AC2235304BC4F762,cany,Winter Road Conditions and Weather,
0,Information,"As of January 1, 2020 day-use permits are required for all canyoneering and climbing activities in the park. Permits are free and require self-registration at the visitor center or via email.",AA528D75-0E0A-D65C-32A48093536C39A0,care,Canyoneering and Rock Climbing Permits,https://www.nps.gov/care/learn/news/pilot-canyoneering-permit-system.htm
0,Caution,"Due to recent floods, the Sulphur Creek route now requires hikers to swim through multiple deep pools of water. Several serious injuries have occurred. Use caution; this route is not a maintained trail and conditions change based on weather.",B61EFC0C-B0E1-7314-EF4603ECBCE8CCB9,care,Sulphur Creek Route Conditions,
0,Information,"Campsites are reservable from March 1 - October 31. Visit www.recreation.gov to make a reservation. Reservations are accepted 6 months ahead of time. From November 1 - February 28, all campsites are first come, first served.",D0ABFA9C-1DD8-B71B-0BD0D292DFB111BE,care,Fruita campground reservations,
0,Park Closure,Park Central Road will be closed at various times throughout the winter due to inclement weather. Manahan (gravel) Road and Park Central Road (west of Manahan Road) will remain closed for the winter.  Call the visitor center for updates 301-663-9388.,71807817-0F33-7B22-50858232844CE186,cato,Winter Road Closures,
0,Information,"The use of unmanned aircraft, also known as drones, is prohibited within Carlsbad Caverns National Park.",6CD5615F-1DD8-B71B-0BA54154BB9E3F55,cave,Unmanned Aircraft (Drones) Are Prohibited,https://www.nps.gov/articles/unmanned-aircraft-in-the-national-parks.htm
0,Information,"For safety, closed-toe shoes with good traction are recommended. Flip flops, sandals, and some walking shoes have little or no traction and increase the possibility of slips, trips, and falls. Watch your step and use the handrails when necessary.",870765A1-916B-7E44-234D99D34AE56D73,cave,Footwear in the Cavern,
0,Information,"A disease know as White-nose Syndrome is killing bats in North America. To prevent it from spreading to our bats, do not wear shoes, clothing, or bring any gear into any cave at Carlsbad Caverns National Park that were in another cave.",872089CE-1DD8-B71B-0B98C1B0DEF4E239,cave,Items Worn or Used in Other Caves Not Allowed,https://www.nps.gov/articles/what-is-white-nose-syndrome.htm
0,Caution,"There is a 90-yard road segment of Volcano Road that will be one lane only, and we
ask visitors to follow road rules and restrictions to keep the road safe for everybody.",ABDCDFCB-FAFA-EDA0-AFC3724888C9785B,cavo,Volcano Road Partially Reopens with One-Way Lane,https://www.nps.gov/cavo/learn/news/volcano-road-opens.htm
0,,Both the Chickamauga Battlefield Visitor Center and the Lookout Mountain Visitor Center at Point Park will be closed on Christmas Day (December 25) and New Years Day (January 1).,B61ADA6E-1DD8-B71C-0781A32CA497CCB1,chch,Holiday Hours,
0,Information,"Beginning December 1, the Wilder Brigade Monument (tower), the Highway 27 Picnic Area, and the Signal Point restrooms are closed for the winter. They will re-open in the spring.",859F7B95-1DD8-B71B-0B0A3886E731C9A3,chch,Seasonal Closures,
0,Caution,"Signs of rabid animals include:
Appearing sick or tame; difficulty moving; aggressive behavior; drooling or biting; active during abnormal hours. Report dead or unusual wildlife observations to park ranger: 520-824-3560 x9302",7E9FC44C-1DD8-B71B-0B215133957FAA7B,chir,"Rabies Warning: do not approach, feed, or touch wild animals",https://www.nps.gov/chir/planyourvisit/conditions.htm
0,Caution,"Due to recent winter weather, there may be snow or ice on Bonita Canyon Drive. Please use extreme caution and drive slowly.",7B1C63D4-B483-DEE2-380D24671FAC5635,chir,Icy Road Conditions,
0,Information,"Santa Barbara Island is open to public access, but landings are restricted to the rocky ledge adjacent to the dock. The dock is closed and is not expected to be repaired in the near future due to the severe winter storm damage.",717669CF-1DD8-B71B-0B41D79BEFF117F0,chis,Santa Barbara Island Dock Closed; Landings Restricted to Adjacent Rocky Ledge,https://www.nps.gov/chis/planyourvisit/conditions.htm
